{
  "id": "f8a9b0c1-d2e3-4e4f-a5b6-c7d8e9f0a1b2",
  "name": "repair-wu-reset",
  "description": "Reseteo completo de Windows Update: limpieza de caché, reinicio de servicios y restauración de componentes",
  "area": "system",
  "os": ["windows"],
  "category": "repair",
  "risk": "W-L",
  "reversible": true,
  "parameters": {},
  "permissions": ["admin"],
  "timeout_ms": 120000,
  "evidence": ["log", "before", "after"],
  "output_schema": {},
  "associated_repair": "restore-wu-backup",
  "remote_support": "none",
  "rollback_module": "restore-wu-backup",
  "min_os_version": "10.0.10240",
  "version": "1.0.0",
  "tags": ["windows-update", "wu", "reset", "reparacion", "actualizaciones", "cache"]
}
