{
  "id": "e3f4a5b6-c7d8-43e9-f0a1-b2c3d4e5f6a7",
  "name": "admin-mbr-gpt",
  "description": "Conversión de tabla de particiones MBR a GPT: verificación de compatibilidad, conversión sin pérdida de datos y validación",
  "area": "system",
  "os": ["windows"],
  "category": "admin",
  "risk": "!",
  "reversible": false,
  "parameters": {},
  "permissions": ["admin"],
  "timeout_ms": 120000,
  "evidence": ["log", "confirmation"],
  "output_schema": {},
  "associated_repair": null,
  "remote_support": "none",
  "rollback_module": null,
  "min_os_version": "10.0.10240",
  "version": "1.0.0",
  "tags": ["mbr", "gpt", "particion", "conversion", "uefi", "admin", "mbr2gpt"]
}
