{
  "id": "e5f6a7b8-c9d0-4f5e-a2b3-c4d5e6f7a8b9",
  "name": "artec-mill-network",
  "description": "Verificación de conectividad de red de la fresadora dental: ping, latencia, puerto de comunicación y estado de enlace",
  "area": "artec",
  "os": ["windows"],
  "category": "production",
  "risk": "R",
  "reversible": true,
  "parameters": {},
  "permissions": ["admin"],
  "timeout_ms": 30000,
  "evidence": ["log", "report"],
  "output_schema": {},
  "associated_repair": null,
  "remote_support": "readonly",
  "rollback_module": null,
  "min_os_version": "10.0.10240",
  "version": "1.0.0",
  "tags": ["artec", "red", "fresadora", "conectividad", "dental", "produccion"]
}
