{
  "id": "f4a5b6c7-d8e9-44f0-a1b2-c3d4e5f6a7b8",
  "name": "admin-bitlocker",
  "description": "Gestión de BitLocker: estado de cifrado, claves de recuperación, protectores y auditoría de cumplimiento",
  "area": "system",
  "os": ["windows"],
  "category": "admin",
  "risk": "!",
  "reversible": true,
  "parameters": {},
  "permissions": ["admin"],
  "timeout_ms": 60000,
  "evidence": ["log", "confirmation"],
  "output_schema": {},
  "associated_repair": null,
  "remote_support": "none",
  "rollback_module": null,
  "min_os_version": "10.0.10240",
  "version": "1.0.0",
  "tags": ["bitlocker", "cifrado", "seguridad", "tpm", "recuperacion", "admin"]
}
